{
  "appId": "google-review-responder",
  "version": 1,
  "name": "Google review responder",
  "tagline": "Every Google review read, drafted, and answered on-brand.",
  "who": "A restaurant owner checking reviews at midnight.",
  "how": "Daily fetch of new Google reviews with on-brand replies queued for one-tap approval; 1-star reviews escalate immediately with a service-recovery draft.",
  "category": "growth",
  "accent": "oklch(0.55 0.13 30)",
  "connectors": [
    {
      "id": "browser",
      "label": "Shared browser sign-in",
      "required": false
    }
  ],
  "setupMinutes": {
    "min": 3,
    "max": 6
  },
  "adds": {
    "crons": [
      "Review fetch (daily)"
    ],
    "apps": [
      "Review queue"
    ]
  }
}
