{
  "appId": "social-repurposer",
  "version": 1,
  "name": "Social repurposer",
  "tagline": "One input becomes a week of on-voice social posts.",
  "who": "A boutique fitness studio owner with no time for content.",
  "how": "Give it one thing — a schedule change, a client win, a photo — and it drafts Instagram, Facebook, and Google post variants in your voice, queued for approval.",
  "category": "growth",
  "accent": "oklch(0.55 0.13 30)",
  "connectors": [
    {
      "id": "browser",
      "label": "Shared browser sign-in",
      "required": false
    }
  ],
  "setupMinutes": {
    "min": 2,
    "max": 5
  },
  "adds": {
    "crons": [],
    "apps": [
      "Post queue"
    ]
  }
}
