{
  "appId": "yelp-review-responder",
  "version": 1,
  "name": "Yelp review responder",
  "tagline": "Yelp reviews handled with Yelp-appropriate etiquette.",
  "who": "A salon or restaurant owner whose Yelp page is their storefront.",
  "how": "Daily fetch of new Yelp reviews with drafted replies queued for approval — and it knows Yelp penalizes review solicitation, so it never offers the ask-for-reviews flow.",
  "category": "growth",
  "accent": "oklch(0.55 0.13 30)",
  "connectors": [
    {
      "id": "browser",
      "label": "Shared browser sign-in",
      "required": false
    }
  ],
  "setupMinutes": {
    "min": 3,
    "max": 6
  },
  "adds": {
    "crons": [
      "Review fetch (daily)"
    ],
    "apps": [
      "Review queue (shared)"
    ]
  }
}
