{
  "appId": "website-editor",
  "version": 1,
  "name": "Website editor",
  "tagline": "Edit your site in plain English — preview, publish, roll back.",
  "who": "A restaurant or plumber paying $150/mo to an agency for a site they cannot touch.",
  "how": "Live preview on the sandbox while you describe changes; publish pushes the built site to real hosting, with rollback.",
  "category": "build",
  "accent": "oklch(0.50 0.13 280)",
  "connectors": [],
  "setupMinutes": {
    "min": 5,
    "max": 10
  },
  "adds": {
    "crons": [],
    "apps": [
      "Site editor"
    ]
  }
}
