{
  "appId": "interview-scheduler",
  "version": 1,
  "name": "Interview scheduler",
  "tagline": "Offer slots, confirm, and book — without the email ping-pong.",
  "who": "Any hiring manager without a Calendly habit.",
  "how": "Reads your real calendar, emails candidates three open slots, confirms the pick, and creates the event with a Meet link.",
  "category": "operations",
  "accent": "oklch(0.55 0.13 90)",
  "connectors": [
    {
      "id": "gmail",
      "label": "Gmail",
      "required": true
    },
    {
      "id": "google-calendar",
      "label": "Google Calendar",
      "required": true
    }
  ],
  "setupMinutes": {
    "min": 2,
    "max": 5
  },
  "adds": {
    "crons": [],
    "apps": []
  }
}
