{
  "appId": "speed-to-lead",
  "version": 1,
  "name": "Speed-to-lead responder",
  "tagline": "Answer every inbound lead in minutes, not hours.",
  "who": "A roofing contractor whose form leads go cold — replying within 5 minutes instead of an hour changes close rates.",
  "how": "Watches the inbox for new inquiries, instantly sends a personalized acknowledgment with a booking link, opens a deal card, and texts you when a lead looks hot.",
  "category": "growth",
  "accent": "oklch(0.55 0.13 240)",
  "connectors": [
    {
      "id": "gmail",
      "label": "Gmail",
      "required": true
    },
    {
      "id": "twilio",
      "label": "SMS (Twilio)",
      "required": false
    }
  ],
  "setupMinutes": {
    "min": 4,
    "max": 7
  },
  "adds": {
    "crons": [
      "Inbox watch (every 10 min)"
    ],
    "apps": [
      "Leads inbox"
    ]
  }
}
