{
  "appId": "rfp-finder",
  "version": 1,
  "name": "RFP finder & drafter",
  "tagline": "Matching government solicitations found and pre-drafted.",
  "who": "A small government or facilities contractor.",
  "how": "Daily sweep of SAM.gov and state portals for matching solicitations, a go/no-go summary for each, and boilerplate response sections drafted from your past bids.",
  "category": "growth",
  "accent": "oklch(0.50 0.13 250)",
  "connectors": [
    {
      "id": "browser",
      "label": "Shared browser sign-in",
      "required": false
    }
  ],
  "setupMinutes": {
    "min": 4,
    "max": 7
  },
  "adds": {
    "crons": [
      "Portal sweep (daily)"
    ],
    "apps": []
  }
}
