{
  "appId": "fundraising-crm",
  "version": 1,
  "name": "Fundraising CRM",
  "tagline": "Run the raise like a pipeline — research to term sheet.",
  "who": "A seed-stage founder mid-raise.",
  "how": "Investor kanban (firm, partner, stage, intro path), voice-memo debriefs after each pitch, warm-intro drafts, and a cron that resurfaces every \"circle back in two weeks.\"",
  "category": "growth",
  "accent": "oklch(0.55 0.13 15)",
  "connectors": [
    {
      "id": "gmail",
      "label": "Gmail",
      "required": false
    },
    {
      "id": "google-calendar",
      "label": "Google Calendar",
      "required": false
    }
  ],
  "setupMinutes": {
    "min": 4,
    "max": 9
  },
  "adds": {
    "crons": [
      "Follow-up sweep (weekdays)"
    ],
    "apps": [
      "Investor pipeline"
    ]
  }
}
